833,He is busy today,0.022222314029932022,0.022222356870770454,0.022222299128770828,0.022222304716706276,0.022222334519028664,0.022222314029932022,0.022222373634576797,0.022222299128770828,0.022222299128770828,0.02222231961786747,0.022222330793738365,0.02222231961786747,0.02222234569489956,0.6888874769210815,0.022222304716706276
834,The plan was to use one large aid station with American medics running it. How is this way better?,0.005555603187531233,0.005555607844144106,0.005555612500756979,0.005555599462240934,0.005555599462240934,0.00555560365319252,0.005555602256208658,0.005555600393563509,0.005555601324886084,0.005555607844144106,0.00555562786757946,0.005555600393563509,0.005555599927902222,0.005555599927902222,0.9222215414047241
835,It won't take long.,0.016666781157255173,0.01666678488254547,0.016666775569319725,0.016666771844029427,0.016666769981384277,0.016666771844029427,0.01666678488254547,0.016666775569319725,0.016666803508996964,0.016666768118739128,0.016666771844029427,0.7666651010513306,0.016666783019900322,0.01666678860783577,0.016666771844029427
836,"Yes, I have a few problems with your plan. Why are we setting up two aid stations?",0.008333461359143257,0.00833344366401434,0.008333447389304638,0.008333437144756317,0.008333437144756317,0.008333439007401466,0.008333451114594936,0.008333448320627213,0.008333439007401466,0.008333445526659489,0.008333446457982063,0.008333437144756317,0.008333437144756317,0.008333437144756317,0.8833317756652832
837,Can you explain to me why we are setting up two individual aid stations?,0.009523880667984486,0.009523878805339336,0.009523880667984486,0.009523872286081314,0.009523873217403889,0.009523873217403889,0.009523897431790829,0.009523876942694187,0.009523874148726463,0.009523878805339336,0.009523880667984486,0.009523873217403889,0.009523873217403889,0.009523873217403889,0.8666657209396362
838,Is it alright if this waits until the actual mission brief? I'm busy getting ready for it now.,0.007407435681670904,0.0074074361473321915,0.007407431490719318,0.007407440338283777,0.8962958455085754,0.0074074347503483295,0.007407437078654766,0.0074074347503483295,0.007407433819025755,0.007407440338283777,0.007407438009977341,0.007407443597912788,0.007407435681670904,0.0074074361473321915,0.00740743288770318
839,Not all of the details have been finalized so I'm not sure if that it would be of any help to you now.,0.011111142113804817,0.011111142113804817,0.011111147701740265,0.011111141182482243,0.011111144907772541,0.011111144907772541,0.011111142113804817,0.011111151427030563,0.011111143976449966,0.011111140251159668,0.011111144907772541,0.011111141182482243,0.8444439768791199,0.011111142113804817,0.011111143976449966
840,"We have crates of supplies like food, water, and hospital equipment available. As of right now that will be primarily what we are giving the locals.",0.005128238350152969,0.005128239747136831,0.005128238815814257,0.005128238815814257,0.005128238350152969,0.005128240212798119,0.005128238350152969,0.005128239281475544,0.9282045960426331,0.005128238815814257,0.005128239747136831,0.005128238815814257,0.005128238815814257,0.005128256045281887,0.005128241144120693
841,"No, he is not here. I am taking his place.",0.022222330793738365,0.022222327068448067,0.02222234010696411,0.022222332656383514,0.022222327068448067,0.022222327068448067,0.022222349420189857,0.02222234196960926,0.022222334519028664,0.022222330793738365,0.022222330793738365,0.6888872385025024,0.02222239226102829,0.022222327068448067,0.022222327068448067
842,Our American medics are trained at running aid stations and treating patients. They have much more experience than your medics. Our medics should handle the flow of patients.,0.004166693426668644,0.004166693892329931,0.941666305065155,0.004166688770055771,0.0041666883043944836,0.0041666897013783455,0.0041666897013783455,0.004166688770055771,0.0041666897013783455,0.0041666897013783455,0.004166695289313793,0.0041666883043944836,0.004166688770055771,0.004166688770055771,0.004166694357991219
843,Is it alright if this waits until the actual mission brief? I'm busy getting ready for it now.,0.0074074361473321915,0.007407437078654766,0.007407431956380606,0.007407441269606352,0.8962958455085754,0.007407435216009617,0.007407438009977341,0.007407435216009617,0.0074074347503483295,0.007407441269606352,0.007407438941299915,0.007407448720186949,0.0074074361473321915,0.007407437078654766,0.007407433819025755
844,He is busy today,0.02222231589257717,0.022222358733415604,0.022222300991415977,0.022222306579351425,0.022222336381673813,0.02222231589257717,0.022222399711608887,0.022222300991415977,0.022222300991415977,0.02222232148051262,0.022222332656383514,0.02222232148051262,0.022222347557544708,0.6888874769210815,0.022222306579351425
845,Can you explain to me why we are setting up two individual aid stations?,0.009523879736661911,0.009523877874016762,0.009523879736661911,0.00952387135475874,0.009523872286081314,0.009523872286081314,0.009523887187242508,0.009523876011371613,0.009523874148726463,0.009523877874016762,0.009523879736661911,0.009523872286081314,0.009523872286081314,0.009523872286081314,0.8666657209396362
846,"Ok. Now that we're in private, why did you say that we would set up two aid stations?",0.007407506462186575,0.007407508324831724,0.00740751251578331,0.007407518103718758,0.007407511584460735,0.007407498080283403,0.0074075073935091496,0.007407504133880138,0.007407503202557564,0.007407506462186575,0.007407521363347769,0.007407497614622116,0.007407510653138161,0.007407509256154299,0.896294891834259
847,"This mission has to happen, there are refugees that need these supplies and without your men we can't deliver them. Is there nothing we can do to work this out?",0.005555585492402315,0.922221839427948,0.005555582698434591,0.005555583164095879,0.005555582698434591,0.005555583629757166,0.005555583164095879,0.0055555845610797405,0.00555558642372489,0.005555581301450729,0.005555581767112017,0.005555587355047464,0.005555580835789442,0.005555583629757166,0.0055555845610797405
848,"I saw you pointing at the containers here.Would the issue have to do with that? We can make this work, we have to.",0.008333368226885796,0.00833336915820837,0.8833328485488892,0.008333403617143631,0.008333365432918072,0.008333367295563221,0.008333371952176094,0.008333368226885796,0.008333365432918072,0.008333366364240646,0.008333366364240646,0.008333368226885796,0.00833337102085352,0.00833336915820837,0.008333367295563221
849,"I'd really prefer just to wait until the brief, if that is ok.",0.011111188679933548,0.011111182160675526,0.011111180298030376,0.8444434404373169,0.011111200787127018,0.011111184023320675,0.011111181229352951,0.011111185885965824,0.011111199855804443,0.011111185885965824,0.011111189611256123,0.011111188679933548,0.011111189611256123,0.011111180298030376,0.01111118495464325
850,Not all of the details have been finalized so I'm not sure if that it would be of any help to you now.,0.011111142113804817,0.011111142113804817,0.011111147701740265,0.011111141182482243,0.011111144907772541,0.011111144907772541,0.011111142113804817,0.011111151427030563,0.011111143976449966,0.011111140251159668,0.011111144907772541,0.011111141182482243,0.8444439768791199,0.011111142113804817,0.011111143976449966
851,Can you explain to me why we are setting up two individual aid stations?,0.009523880667984486,0.009523878805339336,0.009523880667984486,0.009523872286081314,0.009523873217403889,0.009523873217403889,0.009523888118565083,0.009523876942694187,0.009523874148726463,0.009523878805339336,0.009523880667984486,0.009523873217403889,0.009523873217403889,0.009523873217403889,0.8666657209396362
852,Why does it have to be in private? We don't have a ton of time. ,0.016666756942868233,0.016666768118739128,0.016666755080223083,0.016666758805513382,0.01666676066815853,0.016666755080223083,0.01666676625609398,0.016666755080223083,0.01666676625609398,0.016666751354932785,0.016666758805513382,0.016666781157255173,0.016666753217577934,0.7666653394699097,0.01666676066815853
853,He couldn't make it today because he had unexpected business come up. I will be in charge in his absence.,0.007407439406961203,0.007407442666590214,0.007407439406961203,0.007407439406961203,0.007407438475638628,0.007407441269606352,0.007407470140606165,0.007407437078654766,0.007407437544316053,0.007407437544316053,0.007407443597912788,0.007407441269606352,0.007407448720186949,0.8962957859039307,0.007407439406961203
854,"This mission has to happen, there are refugees that need these supplies and without your men we can't deliver them. Is there nothing we can do to work this out?",0.005555585026741028,0.922221839427948,0.005555582232773304,0.005555582698434591,0.005555582232773304,0.005555583164095879,0.005555582698434591,0.005555584095418453,0.0055555859580636024,0.005555580835789442,0.005555581301450729,0.005555597133934498,0.005555580370128155,0.005555583164095879,0.005555584095418453
855,"What? But we have plenty of supplies, we need your men to help us, we can't do it without you since we are stretched so thin already.",0.005128256045281887,0.00512823648750782,0.005128230433911085,0.005128230433911085,0.005128232296556234,0.005128234624862671,0.005128229968249798,0.005128235090523958,0.9282047152519226,0.005128229968249798,0.00512823136523366,0.005128234624862671,0.005128232296556234,0.005128233693540096,0.00512823136523366
856,"But we cannot do this without you. I'll have to scrap my plan and notify my commander, I think we both would like to keep it from getting to that level so can we try and figure something out on our level? There has to be a compromise we can reach.",0.0037037236616015434,0.003703723894432187,0.0037037236616015434,0.003703723894432187,0.003703725291416049,0.003703727386891842,0.0037037257570773363,0.003703728085383773,0.003703723894432187,0.003703725291416049,0.9481478333473206,0.0037037248257547617,0.003703723894432187,0.0037037257570773363,0.00370372598990798
857,Why does it have to be in private? We don't have a ton of time. ,0.016666756942868233,0.016666768118739128,0.016666755080223083,0.016666758805513382,0.01666676066815853,0.016666755080223083,0.01666676625609398,0.016666755080223083,0.01666676625609398,0.016666751354932785,0.016666758805513382,0.01666678488254547,0.016666753217577934,0.7666653394699097,0.01666676066815853
858,"Our medics are better at doing this sort of thing, and your men are better at site security.",0.008333413861691952,0.008333422243595123,0.008333424106240273,0.008333412930369377,0.008333413861691952,0.008333412930369377,0.008333430625498295,0.008333411067724228,0.008333411999046803,0.008333412930369377,0.00833341758698225,0.008333411067724228,0.008333414793014526,0.008333411067724228,0.8833321928977966
859,"I hope everything was resolved. if it is alright, I have a few questions about the mission since I heard you had a flight delay and that will affect how many Chinese soldiers are on the ground. ",0.0041666883043944836,0.004166684579104185,0.004166684113442898,0.00416668551042676,0.9416664242744446,0.004166684579104185,0.004166685044765472,0.004166685976088047,0.004166686441749334,0.004166691098362207,0.004166684579104185,0.00416668551042676,0.004166685044765472,0.004166685044765472,0.004166684579104185
860,"Hello, sir. Have you eaten yet?",0.01333347987383604,0.01333347987383604,0.01333347987383604,0.01333347987383604,0.013333486393094063,0.013333484530448914,0.013333483599126339,0.01333347987383604,0.8133312463760376,0.013333483599126339,0.01333347987383604,0.013333483599126339,0.013333486393094063,0.013333484530448914,0.01333347987383604
861,He couldn't make it today because he had unexpected business come up. I will be in charge in his absence.,0.007407439406961203,0.007407442666590214,0.007407439406961203,0.007407439406961203,0.007407438475638628,0.007407441269606352,0.007407474331557751,0.007407437078654766,0.007407437544316053,0.007407437544316053,0.007407443597912788,0.007407441269606352,0.007407448720186949,0.8962957859039307,0.007407439406961203
862,"No, he is not here. I am taking his place.",0.022222330793738365,0.022222327068448067,0.02222234010696411,0.022222332656383514,0.022222327068448067,0.022222327068448067,0.022222349420189857,0.02222234196960926,0.022222334519028664,0.022222330793738365,0.022222330793738365,0.6888872385025024,0.022222405299544334,0.022222327068448067,0.022222327068448067
863,Can I talk with you in private once questions are over?,0.016666747629642487,0.016666768118739128,0.01666674204170704,0.016666779294610023,0.01666676625609398,0.016666751354932785,0.01666676439344883,0.01666674204170704,0.01666676066815853,0.016666768118739128,0.016666745766997337,0.016666751354932785,0.01666674017906189,0.7666653990745544,0.016666749492287636
864,"Oh, is it about the plane being delayed? We have plenty of supplies here to compensate so we can accomplish the mission together until it arrives. I'm sure we can figure something out.",0.004761932417750359,0.004761931020766497,0.004761929623782635,0.004761938471347094,0.004761931952089071,0.0047619398683309555,0.004761931020766497,0.9333329200744629,0.004761932417750359,0.004761931486427784,0.004761931486427784,0.004761933349072933,0.004761932883411646,0.004761930089443922,0.004761931020766497
865,"This mission has to happen, there are refugees that need these supplies and without your men we can't deliver them. Is there nothing we can do to work this out?",0.005555585026741028,0.922221839427948,0.005555582232773304,0.005555582698434591,0.005555582232773304,0.005555583164095879,0.005555582698434591,0.005555584095418453,0.0055555859580636024,0.005555580835789442,0.005555581301450729,0.00555561063811183,0.005555580370128155,0.005555583164095879,0.005555584095418453
866,"We have crates of supplies like food, water, and hospital equipment available. As of right now that will be primarily what we are giving the locals.",0.005128237418830395,0.005128239281475544,0.005128237884491682,0.005128237884491682,0.005128237418830395,0.005128239747136831,0.005128237418830395,0.005128238350152969,0.9282045960426331,0.005128237884491682,0.005128239281475544,0.005128237884491682,0.005128237884491682,0.005128249526023865,0.005128240212798119
867,There has to be a way. What was name of the man you were talking to? If he is in your chain of command I'd like to talk to him.,0.008333406411111355,0.008333426900207996,0.008333406411111355,0.008333421312272549,0.00833340547978878,0.0083334194496274,0.008333427831530571,0.008333411999046803,0.008333411999046803,0.8833321928977966,0.008333414793014526,0.008333414793014526,0.008333411067724228,0.008333427831530571,0.008333413861691952
868,"Ok. Now that we're in private, why did you say that we would set up two aid stations?",0.007407506462186575,0.007407508324831724,0.00740751251578331,0.007407518103718758,0.007407511584460735,0.007407498080283403,0.0074075073935091496,0.007407504133880138,0.007407503202557564,0.007407506462186575,0.007407540455460548,0.007407497614622116,0.007407510653138161,0.007407509256154299,0.896294891834259
869,I’d rather not say.,0.022222409024834633,0.022222382947802544,0.022222420200705528,0.6888866424560547,0.022222453728318214,0.022222360596060753,0.0222223661839962,0.02222236432135105,0.022222360596060753,0.022222409024834633,0.022222379222512245,0.022222360596060753,0.02222236804664135,0.022222360596060753,0.022222371771931648
870,Not all of the details have been finalized so I'm not sure if that it would be of any help to you now.,0.011111143045127392,0.011111143045127392,0.01111114863306284,0.011111142113804817,0.011111145839095116,0.011111145839095116,0.011111143045127392,0.011111176572740078,0.011111144907772541,0.011111141182482243,0.011111145839095116,0.011111142113804817,0.8444439172744751,0.011111143045127392,0.011111144907772541
871,I don't have any questions right now.,0.016666756942868233,0.01666676253080368,0.016666743904352188,0.016666758805513382,0.016666769981384277,0.016666745766997337,0.016666756942868233,0.016666745766997337,0.7666653990745544,0.016666756942868233,0.016666745766997337,0.01666676066815853,0.016666743904352188,0.016666807234287262,0.016666747629642487
872,I’d rather not say.,0.022222409024834633,0.022222382947802544,0.022222420200705528,0.6888866424560547,0.022222468629479408,0.022222360596060753,0.0222223661839962,0.02222236432135105,0.022222360596060753,0.022222409024834633,0.022222379222512245,0.022222360596060753,0.02222236804664135,0.022222360596060753,0.022222371771931648
873,Not all of the details have been finalized so I'm not sure if that it would be of any help to you now.,0.011111142113804817,0.011111142113804817,0.011111147701740265,0.011111141182482243,0.011111144907772541,0.011111144907772541,0.011111142113804817,0.011111162602901459,0.011111143976449966,0.011111140251159668,0.011111144907772541,0.011111141182482243,0.8444439768791199,0.011111142113804817,0.011111143976449966
874,"Oh, is it about the plane being delayed? We have plenty of supplies here to compensate so we can accomplish the mission together until it arrives. I'm sure we can figure something out.",0.004761932417750359,0.004761931020766497,0.004761929623782635,0.00476193567737937,0.004761931952089071,0.004761936143040657,0.004761931020766497,0.9333329200744629,0.004761932417750359,0.004761931486427784,0.004761931486427784,0.004761933349072933,0.004761932883411646,0.004761930089443922,0.004761931020766497
875,Why does it have to be in private? We don't have a ton of time. ,0.016666758805513382,0.016666769981384277,0.016666756942868233,0.01666676066815853,0.01666676253080368,0.016666756942868233,0.016666768118739128,0.016666756942868233,0.016666768118739128,0.016666753217577934,0.01666676066815853,0.016666783019900322,0.016666755080223083,0.7666652798652649,0.01666676253080368
876,There has to be a way. What was name of the man you were talking to? If he is in your chain of command I'd like to talk to him.,0.00833340734243393,0.008333496749401093,0.00833340734243393,0.008333422243595123,0.008333406411111355,0.008333420380949974,0.008333428762853146,0.008333412930369377,0.008333412930369377,0.8833320736885071,0.008333415724337101,0.008333415724337101,0.008333411999046803,0.00833342969417572,0.008333414793014526
877,"I hope everything was resolved. if it is alright, I have a few questions about the mission since I heard you had a flight delay and that will affect how many Chinese soldiers are on the ground. ",0.004166687838733196,0.004166684113442898,0.0041666836477816105,0.004166685044765472,0.9416664242744446,0.004166684113442898,0.004166684579104185,0.00416668551042676,0.004166685976088047,0.004166693892329931,0.004166684113442898,0.004166685044765472,0.004166684579104185,0.004166684579104185,0.004166684113442898
878,"I know you have men available, can you just spare a few of them to help us? We have all the supplies for the near term, we just need manpower.",0.0060606361366808414,0.006060643587261438,0.006060635205358267,0.0060606347396969795,0.006060636602342129,0.915151059627533,0.006060633342713118,0.006060637999325991,0.006060641258955002,0.006060633342713118,0.0060606347396969795,0.006060637533664703,0.006060638930648565,0.006060641258955002,0.0060606347396969795
879,"I understand you have your orders, but I also have mine--to get these supplies to the refugees. I don't mean to work around you, but I am going to have to find men to accomplish mission, even if it means talking to our chain of command.",0.003333376022055745,0.003333380678668618,0.0033333736937493086,0.003333377419039607,0.003333374159410596,0.9533246755599976,0.0033333818428218365,0.0033333769533783197,0.003333374159410596,0.003333375556394458,0.0033333732280880213,0.0033414133358746767,0.0033333732280880213,0.0033333762548863888,0.003333374857902527
880,I don't have any questions right now.,0.016666756942868233,0.01666676253080368,0.016666743904352188,0.016666758805513382,0.016666769981384277,0.016666745766997337,0.016666756942868233,0.016666745766997337,0.7666653990745544,0.016666756942868233,0.016666745766997337,0.01666676066815853,0.016666743904352188,0.016666797921061516,0.016666747629642487
881,"I hope everything was resolved. if it is alright, I have a few questions about the mission since I heard you had a flight delay and that will affect how many Chinese soldiers are on the ground. ",0.004166687838733196,0.004166684113442898,0.0041666836477816105,0.004166685044765472,0.9416664242744446,0.004166684113442898,0.004166684579104185,0.00416668551042676,0.004166685976088047,0.004166696220636368,0.004166684113442898,0.004166685044765472,0.004166684579104185,0.004166684579104185,0.004166684113442898
882,"When I made the plan, I believed that securing the site and protecting the victims was the most important task. Your men have good experience in security, so I wanted them to make sure everyone is safe. Our supplies are better suited for running the aid station.",0.0027778020594269037,0.0027778022922575474,0.0027778055518865585,0.0027778027579188347,0.002777800429612398,0.00277780182659626,0.0027778022922575474,0.0027778027579188347,0.0027778013609349728,0.00277780182659626,0.0027778020594269037,0.002777801128104329,0.002777806017547846,0.0027778013609349728,0.9611107707023621
883,"No, he is not here. I am the officer in charge of the U.S. component of the coalition.",0.011111176572740078,0.011111177504062653,0.011111175641417503,0.011111198924481869,0.011111176572740078,0.8444433808326721,0.011111180298030376,0.011111177504062653,0.011111191473901272,0.011111186817288399,0.011111179366707802,0.011111191473901272,0.011111186817288399,0.011111196130514145,0.011111181229352951
884,"We have crates of supplies like food, water, and hospital equipment available. As of right now that will be primarily what we are giving the locals.",0.005128238350152969,0.005128239747136831,0.005128238815814257,0.005128238815814257,0.005128238350152969,0.005128240212798119,0.005128238350152969,0.005128239281475544,0.9282045960426331,0.005128238815814257,0.005128239747136831,0.005128238815814257,0.005128238815814257,0.005128261633217335,0.005128241144120693
885,"No, he is not here. I am the officer in charge of the U.S. component of the coalition.",0.011111177504062653,0.011111178435385227,0.011111176572740078,0.011111200787127018,0.011111177504062653,0.8444433808326721,0.011111181229352951,0.011111178435385227,0.011111192405223846,0.011111187748610973,0.011111180298030376,0.011111192405223846,0.011111187748610973,0.01111119706183672,0.011111182160675526
886,"Then please work with me here. There are plenty of supplies to go around. I don't want to do it either, it looks bad for both of us.",0.00555561063811183,0.005555613432079554,0.0055556087754666805,0.00555561063811183,0.005555605515837669,0.005555612966418266,0.005555611569434404,0.9222214818000793,0.0055556162260472775,0.005555606912821531,0.005555605981498957,0.005555620416998863,0.005555606912821531,0.005555612500756979,0.005555607378482819
887,What about the fellow who was here earlier? Can I talk to him? It seemed like you both were talking about this.,0.009523892775177956,0.009523911401629448,0.009523889049887657,0.8666654229164124,0.009523890912532806,0.009523901157081127,0.009523915126919746,0.009523896500468254,0.009523897431790829,0.009523900225758553,0.009523898363113403,0.00952389370650053,0.009523900225758553,0.00952390767633915,0.009523898363113403
888,"I appreciate you looking out for your team, but you will get all of it soon when we have the brief this afternoon. ",0.008333384990692139,0.008333382196724415,0.00833338126540184,0.00833339523524046,0.008333390578627586,0.008333384059369564,0.008333384990692139,0.008333384059369564,0.00833338312804699,0.00833339337259531,0.008333384990692139,0.8833326101303101,0.008333382196724415,0.008333382196724415,0.008333382196724415
889,"Then please work with me here. There are plenty of supplies to go around. I don't want to do it either, it looks bad for both of us.",0.00555561063811183,0.005555613432079554,0.0055556087754666805,0.00555561063811183,0.005555605515837669,0.005555612966418266,0.005555611569434404,0.9222214818000793,0.0055556162260472775,0.005555606912821531,0.005555605981498957,0.005555620416998863,0.005555606912821531,0.005555612500756979,0.005555607378482819
890,Is it alright if this waits until the actual mission brief? I'm busy getting ready for it now.,0.0074074361473321915,0.007407437078654766,0.007407431956380606,0.007407441269606352,0.8962958455085754,0.007407435216009617,0.007407438009977341,0.007407435216009617,0.0074074347503483295,0.007407441269606352,0.007407438941299915,0.0074074543081223965,0.0074074361473321915,0.007407437078654766,0.007407433819025755
891,Is it alright if this waits until the actual mission brief? I'm busy getting ready for it now.,0.007407435681670904,0.0074074361473321915,0.007407431490719318,0.007407440338283777,0.8962958455085754,0.0074074347503483295,0.007407437078654766,0.0074074347503483295,0.007407433819025755,0.007407440338283777,0.007407438009977341,0.007407446391880512,0.007407435681670904,0.0074074361473321915,0.00740743288770318
892,"I appreciate you looking out for your team, but you will get all of it soon when we have the brief this afternoon. ",0.008333384990692139,0.008333382196724415,0.00833338126540184,0.00833339523524046,0.008333390578627586,0.008333384059369564,0.008333384990692139,0.008333384059369564,0.00833338312804699,0.008333394303917885,0.008333384990692139,0.8833326101303101,0.008333382196724415,0.008333382196724415,0.008333382196724415
893,Not all of the details have been finalized so I'm not sure if that it would be of any help to you now.,0.011111142113804817,0.011111142113804817,0.011111147701740265,0.011111141182482243,0.011111144907772541,0.011111144907772541,0.011111142113804817,0.011111151427030563,0.011111143976449966,0.011111140251159668,0.011111144907772541,0.011111141182482243,0.8444439768791199,0.011111142113804817,0.011111143976449966
