"","topic","document"
"143",3,"think like four peopl like can brain attack like problem like sophomor like dont much knowledg might input project show us like proper direct go project yeah think like call like via skype just presenc meet think realli help us issu might abl help us like fix your right your like nearbi easi contact can continu work project like littl input throughout meet"
"144",3,"yeah think that pretti good idea can just like check make sure like like your still technic leader professor assign leader like check like look right direct like im take group wrong direct make sure your also stay involv think assign leader role okay still think make final decis end day your leader im just one gave work"
"145",3,"help think just someth kind balanc workload nice just littl bit mean sinc there four us mean nice like twenti five percent split way"
"146",3,"yeah think okay lot us take lot work can kind handl know your busi just mayb meet mayb talk divid task just keep account dont mind shoulder littl bit extra work think your abl come meet mayb least tri work kind stay engag meet great great contribut note may littl bit outsid research think just general contribut like meet realli help yeah great yeah that good connect sound good well just make sure clear task cant make meet that fine can move forward"
"147",3,"that tough question three year im definit go keep work best alway um feel like know mayb go right away like year two coupl year know feel like can earn littl bit bump pay somewher els might take opportun ive got famili understand"
"148",3,"oh um guess just want give head knew lot influenc guess will just appli"
"149",3,"yeah absolut um just tell everyth i’v told think bring work record will speak"
"150",3,"um think will definit continu keep word work think ive keep now definit think bring custom think futur abil realli well higher manag posit get understand vision compani well well abl lead better thing futur"
"151",3,"think that’ fine long also see i’m come think deserv higher salari"
"152",3,"think extent work ive also understand extraordinari reason abl understand real reason"
"153",3,"yeah cours just though let know see opinion first"
